	id	sentence1	sentence2	similarity
8060	c2d478782bf476a290137acc3	It is more effective to take decisions for yourself and have others take theirs.	The point is to know what you want and don't be afraid to ask for it.	0.0
3833	9a6c39d1a47065b01d9a78772	Australian unemployment has risen to 5.1 percent	The French unemployment rate has reached 10 percent.	1.0
7990	497f0e9f305b06a377bc896dc	I've found an article that might be of some help: http://www.dsattorney.com/qa-pseudonyms-in-contracts/	I found a link that might be of help to you:	3.0
5088	907b090dc3c3d268d3940c42e	Assad used chemical weapons on Syrian rebels	Assad agrees to destroy his chemical weapons	1.8
311	4dc0038a4726b6f0f9aaf7f3c	A man is playing the keyboard.	Someone is playing the piano.	2.2
1992	83c3a5e9efc1bcd433991683a	Someone is skateboarding in mid-air above a ramp.	A biker is riding along a wooded track element.	0.6
1004	df18f41075aec172071df52ac	A passenger train is waiting in a station.	A passenger train sits in the station.	4.8
3591	fe1732359bf8fae7c091137a5	The Iranian government has dismissed the allegations presented to the International Atomic Energy Agency as unfounded and the intelligence used to support the allegations as fabricated.	The International Atomic Energy Agency insists that Iran's simple denials of the intelligence presented to the International Atomic Energy Agency board are not sufficient to alleviate Western countries' suspicions.	2.2
937	4b425ae17573412e1a279c6d1	A man performs on stage.	A man guts a fish.	0.4
3168	26867af113e52ee088dbf2ed7	The New York Mets then selected Lastings Milledge, outfielder, from Lakewood Ranch High School in Florida.	The Mets selected Lastings Milledge, an outfielder from Florida, with the 12th pick.	3.8
6369	e94b4ac79308ab49cfe86c558	A blonde woman is in a tunnel.	The couple kissing is near a blonde woman.	1.6
5462	d013fbc1eaebd9be24d05e9a5	Boston bombing suspect identified on surveillance video, no arrest.	The mother of the Boston bombing suspect says he was under FBI surveillance	3.4
6716	3941baceb68a2d0205959ca2a	I'd suggest you find a bank in your local country, and consider opening a Euro denominated bank account with them.	I doubt you can open a bank account in France if you're not a resident.	1.6
2941	a483b2352570d77aec30870a3	Toronto had 64 probable cases of SARS and nine suspect cases yesterday.	As of Wednesday, there were 65 probable SARS cases in the Toronto region.	3.25
3318	e0042d00f5d7ffab42e1544f2	Bryant previously stated that the hike had a greater impact on demand than officials anticipated.	Chief financial officer Andy Bryant has said that the hike had a greater impact on volume than officials expected.	3.5
2812	dd44020ab3a02706c697d170e	We continue to work with the Saudis on this, but they didn't meet our request for additional security at that time.	But they didn't provide the security we had requested at the time of that particular tragic event, Mr Jordan said.	3.25
2846	4625834aaf3bac69cbf98a97d	British police arrested 21 people early Tuesday in connection with the suspected ritual murder of an African boy whose torso was found in the Thames River.	Police have arrested 21 people in connection with the murder of a young Nigerian child whose headless and limbless torso was found floating in the river Thames.	3.5
3843	e8dd23e2c1e3d99285863f28b	A man was killed in a French anti-terrorism raid.	Man dies in a French anti-terror operation.	4.8
570	6048395b03d3be6574adad68e	A man and a woman are riding on their bicycles.	A man and woman are riding a motorcycle.	2.0
3880	8f63513fb4bdd28e8e6162be7	UN monitors yet to reach site of Syrian 'massacre' – video	UN monitors unable to reach site of Syria killings	4.4
2407	0e0be947ad43acd08edab0236	"The point you quote should say ""I never said rehabilitation could never work."""	For the trillionth time, I've never said rehabilitation doesn't work.	3.4
6208	84d3653c020bd54de332149bc	A group of people are camping on some rocks.	A group of people are standing beside a fire engine.	1.2
7350	4acf47334a6c88bca1d74470e	A woman is petting her pet bunny as she talks to it.	A woman walks her dog onto astro turf.	0.4
5974	1414c8d0d1806c76f8b324a85	The dog couldn't figure out how to get a stick out of the doggy door.	A dog is trying to get through his dog door.	2.75
3722	7ed5f70827cf98d3206e1a4de	Russia said the system is a clear threat to Russian security.	It is a serious threat to international security.	1.8
4069	14a6ee4364412c1147a83bfbe	The Egyptian presidential election will take place on May 23-24	The 2012 US presidential elections	0.6
1240	f7c650060ae6c48d0f16d6d68	A steam engine comes down a train track near trees.	A train is at a train station.	1.4
7607	ce21c42e261cb1abbae794627	A young woman is riding a Bay horse in a dirt riding arena.	A man is staring at a horse with a white mane.	0.8
2975	38d4ebbb64e70d17cbe45c29c	The Dow Jones industrial average .DJI fell 58.69 points, or 0.64 percent, to 9,137.86.	The blue-chip Dow Jones industrial average .DJI fell 86.56 points, or 0.94 percent, to 9,109.99, after giving up more than 1 percent earlier.	2.5
1553	16966e18188ff8f14e214c7f6	Two dogs strolling along the shore.	Two dogs were having fun in the snow.	2.8
6136	2af032d7f001accfbb44b27e6	A man and a woman are sitting on a bench.	A couple sits on a park bench.	3.6
6711	ea43fe5af6a5a6f5bbf7b47c6	I'm delighted to hear that you've started playing hockey, it's a fantastic sport!	A general rule is that every 5-6 hours, one skates.	0.4
8567	1fa968ac25d3b43b8b0aec493	What the papers say, August 19, 2013	What the papers say, December 30, 2013	2.67
6504	ca7e1610694f409cf41db1f3b	The wars in the Middle East are not caused by trade making the area heterogeneous.	They had signed a treaty in 1941, after a few skirmishes in the affected area.	0.6
6439	a664778c79342d0cca75a745e	The shelf life of the cultivar of tomato you purchased is a determining factor.	Tomatoes stored in the fridge will last longer, but I actually advise against keeping them there.	2.0
8306	533d4c2f223185c103d199b44	Bremer, 61, is a former aide to former Secretaries of State William P. Rogers and Henry Kissinger, and was ambassador-at-large for counterterrorism from 1986 to 1989.	Bremer, 61, was a former assistant to former Secretaries of State William P. Rogers and Henry Kissinger.	3.0
3831	f0f88b530cf9d9488643595d8	Cash-rich Apple to pay dividend, buy back shares	Apple to pay a $2.65/share dividend and buy back $10 billion in stock.	3.8
4518	a912372c28e634404c93b3072	North Korea's third test brings it closer to nuclear power status	NATO says North Korea's nuclear test is a grave threat to global peace.	2.2
835	330b3df95372d48cec8179cfb	The man added vegetables to the pot's broth.	A man is adding sliced vegetables to a cooking bowl with water.	3.4
7464	c2da2e71fafe96f06eb674ce9	A man is kicking pots of water.	A man is transforming foods.	1.333
7431	643f6a839fcab339401688b4a	The woman is measuring that other woman.	The lady measured the other woman's ankle.	3.2
3417	4ce656109537b15c5ad86764b	Dogs, he said, are second only to humans in terms of medical understanding and research depth.	He stated that dogs rank second only to humans in terms of medical research subjects.	4.6
1576	4f5cb18c0a1a4e8e7f3c8ca6c	A man in a blue shirt is sprinting across the stadium field.	A man wearing a blue hat and shirt is riding a white horse.	1.0
3829	5adfdd5ff7b2311cf1cf30a28	A tsunami warning has been issued for southern Alaska	Tsunami warning issued after Canada quake	2.4
3673	3b0d731b58eece0c74dbc299c	A number of suspected Islamic militants with alleged Al-Qaeda links have been arrested in Malaysia and Singapore, and officials revealed that the militants' network extends into Indonesia.	Suspected Islamic militants with alleged Al-Qaeda links have been arrested in Malaysia and Singapore.	3.0
2115	d41d14f7bf0902b38eafad99c	Cracklin' Rosie by Neil Diamond We are all vessels filled with many wonders.	We are all vessels filled with many wonders, like Bobby Helm's rendition of Jingle Bell Rock.	1.6
6183	fd056a513ffaa86fbccc65d65	Two dogs are fighting in the snow.	Two dogs were playing in the snow.	3.2
8104	cf4d305c8db0b8274e58b646a	It depends on your choices for what you'll do next and where.	They can, but the method varies depending on the resources you have available.	1.0
8531	ec2eb22ab3971375656ece953	International weapons experts leave Syria, Obama to make a statement	Syrian weapons experts leave, US prepares military operation	2.8
2577	e8ca5e44703d9b0a4166bd0bc	Further out the curve, the benchmark 10-year note US10YT=RR shed 25/32 in price, taking its yield to 3.26 percent from 3.17 percent.	Early Wednesday, the benchmark 10-year US10YT=RR had fallen 16/32 in value, driving its yield up to 3.33 percent from 3.26 percent the previous day.	3.0
2528	f310e06262c60f4967a2c47ae	Shares of LendingTree rose $6.21, or 42 percent, to $20.90 after hitting $21.36 earlier.	LendingTree shares rose 43 percent, or $6.31, to $21, more than doubling in the last two months.	2.75
2333	e1258a293c908199c2dd85b1c	In Foxe basin was frozen.	The fox was mostly frozen.	4.2
1598	6f8bbc09fac226ff39584eed0	two big brown dogs running through the snow	A brown dog is running through the grass.	2.0
253	2da898cb145ba18f290df0260	A woman is sewing on a machine.	A woman is breading some meat.	0.6
501	d23974b881cf1f5c6f9e78171	A woman is chopping an onion.	A woman is peeling an onion.	5.0
7476	fb986fcee5fc298e621f2b0d3	Swimmers are racing in a lake.	Women divers are entering the water from the starting platform.	1.6
1256	6e6a0373b6accf1164e9c5fff	Two dairy cows are drinking from a pond.	Two cows are drinking from a pond.	4.6
2788	ce1ebf29eb0bfd5d30da0002f	On Sunday, long lines formed outside gas stations and cash machines, as Israelis scrambled to prepare for a strike that threatened to shut down the country.	Long lines formed Sunday outside gas stations and people rushed to get money from cash machines as Israelis prepared for the strike's effects.	4.5
7763	c57c5161472079a3b48996aea	Three guys playing a professional basketball game.	Two friends are playing a game of baseball.	2.4
490	e3fa0045ba7bb049d576c03b6	A man is walking down the street.	A man plays the guitar.	0.8
3393	716ccca2969380873a8a66667	Thursday, it estimates it holds 51% of the market in Europe.	Boston Scientific said it has secured 51% of the coated-stent market in Europe.	2.8
6162	a636e9015c6fa1f2dff36626c	A group of people are gathering at a convention waving American flags.	A crowd of people was attending an outdoor event	2.4
2271	1e5f530abc2b40cfe3069fb0d	What conviction were you discussing before?	What conviction would that be?	4.4
6506	38c5393c389f18f18bec67745	In Hinduism and Buddhism, there is a message of peace and an encouragement not to be materialistic.	The discovery by Americans of Asian and other non-European cultures is at issue.	0.0
4769	535330bf5b88e54c410a8faf4	Four people died in a train accident in Indonesia	Five people died after an Indonesian train collided with a fuel truck	3.4
7841	a325a2ec189589cdf7e4cb2ac	People on motorcycles wearing racing gear ride around a racetrack	People on motorcycles ride around a racetrack	3.8
5016	18600c6e409e7551fd28cf662	Death toll in Lebanon bombings rises to 47	One suspect arrested after Lebanon car bombings kill 45 people.	2.8
5474	175e3db885fd6f817a2cdba7b	Polling stations are open for the Ukrainian presidential election.	Nominations are now open for the e.TV Ghana Most Influential Awards.	0.2
7701	aea8186a9b27d85d7a91e59f4	Many football players are sitting on the ground.	A dog rolls on the ground.	0.0
6833	b0ffce7056456315ca5329468	He said he was forced into exile by the world superpower.	Taylor said he was forced into exile by the world's superpower, in an address videotaped at his home.	3.0
2512	cce66b5b86fc028dd7d7536eb	He started in the 1983 Super Bowl, where Miami lost 27-17 to Washington.	He played four seasons in Miami, including the Dolphins' 27-17 loss to Washington in the Super Bowl.	3.0
2974	6d8ed3b0ecb00efe36d300f41	Lawyers and others familiar with the federal investigation believe the probe continues to focus on Campbell, with prosecutors opting to remain silent about the investigation.	Federal prosecutors are tight-lipped about the investigation, but lawyers and those familiar with it say it remains focused on Campbell.	4.8
2896	8bda1273848027d21fce3fee6	At one of the three sampling sites at Huntington Beach, the bacteria readings showed a high presence on June 16 (160) and a moderate presence on June 23 (120).	The readings came back at 160 on June 16 and 120 on June 23 at one of three sampling sites at Huntington Beach.	3.25
6462	a480da5c3679ea1f42a99e0ee	Those expressions could have slightly different meanings, especially when discussing finance.	I suspect the phrase originated from the practice of representing the internet as a cloud shape on network diagrams.	0.4
2563	cfe9fd9275b8f7a88e198cb70	He was released on $3-million bail and immediately returned to Las Vegas, where he had been filming a video.	After posting $3 million bail, Jackson flew to Las Vegas, where he had been working on a video.	3.75
1087	b57c569476024b40dff5e49ee	A black train was running on the train tracks.	A train is running on the train tracks.	4.1
256	37368efb2fd0ae4afaaf837c0	A man is cutting tomatoes into pieces.	A woman is cutting some vegetables.	1.8
7978	b7a69dc4d28e3b1d047070b79	There are a few things you can do :	There are a few modestly effective ways to act at the personal level.	3.0
4481	0632cc44d8691336b8e90ae34	BBC veteran Hall admits child sex abuse	Stuart Hall Admits Sex Assaults On Children	3.4
109	cf4e186a051f313b1c6967ce7	Lionel Richie is dancing on the ceiling.	Lionel Richie dances standing on the ceiling.	4.0
4723	b7a3aae3de8b4f2ec4bfe2e5e	Mumbai photojournalist gangrape case cracked, five accused arrested	Mumbai journalist gang-rape case: All five accused arrested	4.8
7589	e56cd74c27018590f3f6c32e9	Home office space with bright green walls and artwork.	Small office space with vibrant green walls.	3.8
8214	9c589565bf9168a386566b316	Perry has since called two special legislative sessions to try to pass the redistricting plan.	Since then, Texas Governor Rick Perry has called two special sessions to pass this bill.	3.5
1693	80eb19729ece6154b66826f95	Two people are racing a sidecar motorcycle in the mud.	The dog is carrying a long stick in its mouth.	0.0
3008	face747715e5f4493a0c13f5e	I came to Washington to strengthen our ties and ensure we receive more federal funding for California, Schwarzenegger said after meeting with congressional Republicans.	I came to Washington primarily to establish relationships and ensure we receive sufficient federal funding,	4.2
3611	cc76539882d6841fafb150dd2	If Japan rises to the occasion, it will be unbeatable, even in terms of military power.	Ozawa stated that if Japan rises to the occasion, Japan will never be surpassed, even in terms of military power.	3.6
5621	4d4356a748a1e5dcc3b9f6c88	North Korea Deports an Elderly American	North Korea deports detained US war veteran	2.0
3342	9d9dd840e7d5c8bb2261adc3f	He stated that the FDA hoped that Congress and the courts would bring clarity to the situation and some financial relief to consumers.	He said FDA hopes Congress and the courts will bring clarity to the situation and some financial relief to consumers — perhaps before the 2004 elections.	4.0
3317	113942b1e1e5e226aff4115d2	Those reports were rejected by the interior minister, Prince Nayef.	However, the Saudi interior minister, Prince Nayef, denied the reports.	4.25
4163	2fcd9b08abb0c95286b54d1c5	Putin casts his ballot as Russians vote.	Putin is expected to win Russia's presidential election.	1.4
2065	5f341ab37b80c2c84335f9295	A dear friend from Ohio sent me this scandalous stamp.	A dear friend from Ohio sent me this.	3.6
1110	e6e3ce6ffcd26672d90834ee3	A motorcycle is parked next to a car.	A BMW motorcycle is parked between two cars.	3.0
6820	4f86535826ee875e0a50a60e0	Pentagon officials said Mahmoud restricted access to Saddam to his immediate family and others only.	Mahmoud controlled access to Saddam and was frequently at his side.	3.5
7767	3cbef7166369352fefd9a469f	A person is filming outdoors.	There is a couple outdoors.	1.6
5415	9141c46e334db5a77f38b1f5b	The EU declares Hezbollah's military wing a terrorist group.	The EU lists Hezbollah's military wing as a terrorist organization	4.8
6746	3a5c30f5c72124bfb96f7320e	Keep in mind that you can easily express your anger without using profanity.	I believe Stephen King's remarks are valuable in this regard.	0.0
3923	026ee723cbeeb594ea319cc9c	Orphaned Alps massacre girl returns to UK	Alps attack: Girl returns to UK	4.0
7694	1725e03c1dcce17960c77c34e	A brown and white dog is crossing a brown field.	A person is hanging from a rocky cliff.	0.0
411	ff02a7f3e3fd96f8bb8af12dc	The woman is putting paste into a dish.	A woman is pulling some kind of sticky goo out of a bowl.	1.5
5290	28da9439b5803bea70d8aba4e	The Prime Minister will seek a nuclear deal and investments during his visit to Japan.	Manmohan hopes to successfully conclude a nuclear deal with Japan	3.0
1168	264260a2b2831bcf3c2d877af	A Buddha statue sits on a table with a wooden table runner.	A bird is perched on top of a wooden fencepost.	0.4
5161	9a0f85afcdf09950f73ed6dd9	Egypt's presidential election is launched	Egypt has finally issued the long-awaited presidential election law.	2.8
1793	de632355ab04330b9c601fc2d	A dog is rushing in the snow.	Two dogs running in the mud	2.2
1520	1cbbcc3fe4e6cd3f337528048	A young girl is going down a tube slide.	A young girl is playing with a tire swing	1.8
4257	0ad42553dd92bd636ed0bbc05	Agribusiness: Mad cow disease found in California	USDA confirms a case of mad cow disease in California	4.2
5472	2596f6e093f3ff13b182514bf	A man died in a house fire in Co Donegal	A woman died in a house fire in Co Cork.	2.2
1028	caea5801fd87ab1231ccf676a	A school bus is climbing a rural road.	A courier is driving a car along a dirt road.	1.0
5635	8164eeb63c3ce8a45876bce3b	Russian parliament allows Putin to use military forces in Ukraine	President Obama warns Russia to stay out of Ukraine	1.0
3374	bf5afbf8167d5696ad0ae0738	Instead, prosecutors dismissed charges and Rucker left the courtroom a free man.	Instead, he left the courtroom a free man after authorities dropped the charges.	3.4
2272	51c69d2adcc922caf72fe02e3	So I actually read the OP and guess what I found out.	Furthermore, I discovered this: I actually read the OP and guess what I found out.	4.6
6283	c3ff8c4e4c9e5a78f97c48a59	A woman paints a picture of a large building which can be seen in the background.	A person paints a picture of a large building that can be seen in the background.	4.2
3856	b0ca94e72b239adcf0c70c921	At least 39 people died in an explosion at a refinery in Venezuela.	Venezuela mourns oil refinery blast deaths	2.8
4362	96dd68ddfe6c27e44da8356d6	Israel planes strike inside Syria	Israel launches airstrike against Syria	4.6
8102	654435fc9e2efdb8f2b991519	So think of it that way.	Think of it this way.	5.0
2839	1b67bfbdd251c5f17e5ce3f3c	Three no votes would put an end to it for now.	It would take three votes to end the ACC's expansion.	3.667
2132	f608f50507259a70161ce2488	What wasn't sold like that?	It's not how it was marketed, gb.	1.6
6395	ba41589c8649c034aa1cc063b	All we know is this : distant objects are receding from us at a rate proportional to their distance from us.	The expansion of the universe means that objects at very great distances are moving away from each other.	3.4
5500	0a97594ca0e2feef3e6ff278e	Ukraine leader pledges crisis talks	The Ukraine leader has pledged crisis talks.	5.0
360	8baf46526a13d52435c692462	A man is riding a bike.	A woman is strolling down the street.	0.2
155	dcf613c0c2b086834ddca0bbe	A man is paddling a canoe.	A man is playing his harp.	0.667
2478	b0cee5c9d76cece184d09dfbc	In 2001 and 2002, wire transfers from 4 of the company's 40 accounts exceeded $3.2 billion, prosecutors said.	Morgenthau said wire transfers from four of the 40 accounts open at Beacon Hill totaled more than $3.2 billion from 2001 to 2002.	3.8
7661	02897dc95e03d7b47e4e2df27	The black and white dog has its mouth wide open.	A black and white dog jumps in the snow.	1.8
5507	5b877c5e5dee07cdbbdc7965e	The Chinese president meets the Greek PM, calling for a stronger partnership.	The Chinese president meets the Indian vice president	1.8
7951	c6e5ed6920d7164bc64bed26c	How should I proceed about this?	So how should I do this?	4.0
3018	991da9c0e5441d86555282183	Fighting erupted after four North Korean journalists confronted a dozen South Korean activists protesting human rights abuses in the North outside the main media centre.	Trouble flared when North Korean reporters converged on the Taegu media centre to confront activists protesting human rights abuses in the North.	3.4
8218	bc38f5c3a59a1dd37d580d175	A new legitimate download service is targeting PC users.	BuyMusic is the first subscription-free paid download music service for PC users.	2.4
577	8c0a26f81ee57f5f83eae7f0f	A car is parking.	A cat is playing.	0.0
2806	6ad88140ff8af132905af9ca6	That compared with $35.18 million, or 24 cents per share, in the same period last year.	Earnings were affected by a one-time $8 million tax benefit in the same period last year.	1.6
4105	6fa5a0b04c089699952ed7885	A man finds a car on eBay 42 years after it was stolen	A Texas man discovers his car 42 years after it was stolen.	3.6
4450	53657e9a5e4ede275931a8775	Ukrainian Prime Minister resigns amid protests	Turkish Prime Minister signals a return to a hardline stance on protesters.	0.6
8276	4cb991b9ce56541c97fd91969	"A promotional poster, equipped with a countdown dial, evokes the upcoming release of ""Harry Potter and the Order of the Phoenix."""	The crates are full of hardback books from the 'Harry Potter and the Order of the Phoenix' series.	1.5
6103	1d888eaaf9cb4c1498ff231bc	Two brown horses were grazing in a meadow.	Brown horse standing in the middle of a grassy field.	3.0
1933	d1e8d6ae7b2d2d7c5f2bb4a73	A brown dog chases a Frisbee.	A brown dog is sitting on the grass.	1.6
634	cf9a794ab5d2b16c8ed7e7167	The baby is laughing and crawling.	A baby is laughing and crawling on the floor.	4.2
7083	a3bb5bb454f5e97e4e58deaff	Texas residents seek solace at church after deadly blast.	Residents return to the Texas blast site.	2.6
5315	0d1b88bacbf4a418069191bd5	Mumbai Indians put T&T in its place	Indonesians are set to elect their president in a tight race.	0.0
8082	8ef28f5e92cc5623a48b49e53	Unfortunately, this question can only be partially answered.	This cannot be answered in general.	4.0
8180	6daf02274ccc0592714e7556a	The United States condemns these heinous acts committed by killers who know only hate, Bush said, assuring that the killers will be found.	The United States will find the killers of these despicable acts, whose only faith is hate, and they will learn the meaning of American justice.	3.5
4730	f6b520763f47fe1411424197f	Egypt swears in new interim leader	Egypt's army cracks down on the Muslim Brotherhood	0.6
5061	1e4bdf3520ebd7e7fb9e08d6d	Bangla militants escape from prison van in bomb ambush	A Bangladesh prison van was ambushed	3.4
3738	7c06f6bb8f3cb050d27725094	The International Atomic Energy Association announced that Jordan has agreed to the additional measures.	The International Atomic Energy Agency is the United Nations watchdog.	2.0
3849	298524d00d0ba99d1826313ac	Sarkozy is to file a complaint over alleged Gadhafi funding claim.	Sarkozy plans to sue after Gaddafi cash claim bursts into campaign.	3.6
8024	531321c3f381c7c7788433e4d	There are a few things you can do :	There are a few things you can try.	5.0
2344	7a23d9e966c4a3928bf33cf2b	I don't know how freedom of speech will be restricted.	Your freedom of speech will be no more restricted than it is today.	3.8
2637	17c4c00ff17f5a7a3996a8697	Iraq's economy was ravaged during years of U.N. sanctions over its 1990 occupation of Kuwait and by the U.S.-led war to oust Saddam Hussein, which ended in April.	Iraq's economy was shattered under former president Saddam Hussein and by the U.S.-led war to oust him, which ended in April.	3.75
5378	8bace1005b939a07318f1e2f5	Radio: Israel set to release more Palestinian prisoners.	US: Israel to delay Palestinian prisoner release	1.6
909	b0132fdbad591544d9f144e09	A man is slam dunking a ball.	A woman is chopping some onions.	0.0
6011	ffe9b9261d47987925eea8505	A red double-decker bus is driving down a street.	A red two-story bus is driving along the street.	3.8
8572	b3f670becd027ef6961097077	A suicide attack kills eight in Baghdad	Suicide attacks kill 24 people in Baghdad	2.4
4933	894fce0be54044bc2083d7bc8	Three people died in the US marathon bombing	The Taliban denies involvement in the Boston marathon bombing.	1.2
3263	ff73631b7c6e1da961ee634e8	U.S. and European leaders declared on Wednesday that they would work together to prevent Iran from developing nuclear weapons, presenting a united front after months of tensions over Iraq.	Bush said that American and European leaders, at an annual Washington summit, agreed on the importance of preventing Iran from producing nuclear weapons.	3.2
7941	2d65a9452bade5b94d6428d51	You answered your question.	You've answered your own question.	5.0
1233	f460fcd6256c58486a183f742	A red truck spins its tires while a black truck leaves the frame.	A red truck is spinning its tires and emitting smoke behind it.	3.2
537	8bc9f864920480484b76e669b	A man is cutting a potato.	A woman is peeling a potato.	2.333
6514	8de2c2369c60abc668f7a1974	According to http://fr.wikipedia.org/wiki/Histoire_de_Delhi#Époque_ancienne, the city was called Delhi (or Dilli) at least since the 12th/13th century.	"I'm not quite sure, but I remember the Indian media referring to Delhi as ""HASTHINA""."	1.2
820	ce73228845f3d0545ad1dbb79	A young boy sings and plays the guitar.	A child is learning to play the guitar.	3.25
