	id	sentence1	sentence2	similarity
6827	8a0c865d4666b416d7bac1a88	FBI agents arrested a former Ernst & Young partner on federal obstruction of justice charges, U.S. officials said on Thursday.	A former associate of Ernst & Young was detained by FBI agents in the US for allegedly obstructing federal investigations.	4.6
5809	d942c9d95f93a9cf6050fa04d	A woman is mixing ingredients.	A woman is preparing food in a bowl.	3.5
3080	2914d887e0f2b0275104bd9b2	Amazon reported that the New York Attorney General's office had settled civil fraud charges with one of the spoofers it identified.	Amazon and the New York attorney general's office have already settled with one of the alleged email forgers.	3.75
3842	924611ac2aef454be58d70ca4	The Olympic Games' opening ceremony was a global hit.	The opening ceremony gives the Olympics a rocking start	4.2
1102	b92a7e1342e7a4b68bb667dd5	a dog is sleeping under a small table.	A dog is sleeping under a table.	4.6
3509	0d36d4e91e0407fb40503917d	Kashmir is divided between India and Pakistan.	Kashmir is disputed by both India and Pakistan.	4.4
4043	93c11891baa35c0c31cfac211	Several dead, 550 injured in Argentina train crash	49 feared dead in Buenos Aires train crash	1.4
7633	0c80dad23b8b2bcf01025b8af	An older woman is holding a newborn baby.	A woman is sitting on a sofa holding a baby.	3.4
4825	3af4d94c32a9a26296fb76dbf	A 6.3-magnitude quake hits Honshu, Japan: CENC	A magnitude-6.0 quake jolts Santa Cruz Islands: CENC	1.8
7327	24ab280d7aabf54e380aa3756	A machine is sharpening a pencil.	The machine wore down the end of the pencil.	3.8
4673	288dc85692522ed74f9f7cbc4	Egypt's Brotherhood stands firm after killings	Egypt: The Muslim Brotherhood stands behind Morsi	2.4
3718	0878b7424791f8aa44bcea50f	this is particularly true in the most disadvantaged countries.	This was particularly after Ethiopia withdrew its forces.	0.4
556	8a36222adfb91ca7ae05209bf	The man is playing the guitar.	A baby is playing a guitar.	1.8
5983	c0bbf53e9cc1aca293151fdae	The flag was waving in the air.	A flag is waving.	3.75
7278	02f9b7a9f7837b9179939ffee	A little boy is singing and playing his guitar.	A man is singing and accompanying himself on the guitar.	2.2
2551	e663efb08ac5bbb31ffc0af26	They passed through the Lemelson Medical, Educational and Research Foundation Limited Partnership in 2001 to join Syndia.	It said the patents were allegedly assigned to Syndia in 2001 through the Lemelson Medical, Educational and Research Foundation Limited Partnership.	2.4
1755	3c840cb636947a26c8d8e2995	A black dog is running through the snow.	A black pit bull dog is running through the dirt.	2.2
919	93ecdcb47af9f89f588c20265	A man is catching a ball.	A cat is rubbing against a baby.	0.0
7394	49ff3060dff641d9f2a068777	Someone is playing the piano.	Someone is playing guitar.	2.4
6605	6246c65bdac37d6c50c8b41a7	The Question is (from Hinduism); do you exist because of pregnancy?	At least, we must acknowledge that we must be born with the ability and knowledge to learn.	1.8
4132	e7f0aa599293046d5410f3265	World stocks fall before Greek debt deal deadline	Asia stocks fall ahead of Greek debt deal deadline	2.4
4447	15cf52590cc3f1033b485b0a1	2 dead, 2 injured in a middle school shooting in Nevada.	Nevada: 2 dead, 2 hurt in middle school shooting	5.0
4536	d826cc9b62c57da3b812aedbf	Car bomb kills one and wounds five in Benghazi	A car bomb has exploded at the Libyan Foreign Ministry in Benghazi.	3.0
4195	2daf6791c949e95aa381b71d2	Japan PM calls for quicker tsunami waste processing	Japan marks one year since the earthquake and tsunami disaster	1.0
5951	b2ed2e7870cea7040966caff9	A man is playing the guitar.	A woman is riding a horse.	0.5
661	e16b2e27064475876376ea796	A man looks out the window.	A man looks out the window.	4.8
4886	8c88086c061b830221a5eec57	The EU renews sanctions against Zimbabwe	The EU lifts diamond sanctions against Zimbabwe	3.0
5164	a128bcf65db1f6a7bd932d503	Russian lawmakers pass a new bill limiting internet freedoms.	Russia says ballistic 'objects' fired in Mediterranean	0.4
8106	2168ed3541d8e7d8e0b6d7b93	In the US, it depends on the school.	This depends on the university in question.	4.0
4152	24f6003f2365047bf50955db3	Romney chooses Paul Ryan as running mate	Romney chooses Paul Ryan as GOP running mate	4.4
1508	8b6483953f2a199ffb1adbcca	A man is suspended by a rope above the water, above a precipice.	A man is sitting alone on a pier with a bottle of water.	0.6
8138	b579828762b7c7bcff015f5d6	Local police authorities are investigating the explosion as a crime and all leads are still open.	Acting New Haven Police Chief Francisco Ortiz said police were investigating the explosion as a criminal matter.	3.4
2432	27d2347b5bf10bad57e168c64	Cone threw a tie game.	Addie Joss Cone threw a shutout.	4.2
3951	4802b07ad9bc12200861f4ea3	9 people were killed in attacks following a deadly day in Iraq.	19 people were killed in Iraq attacks ahead of Ramadan's end	1.4
2620	02c2f03f10c28cb72a9a7be6e	I don't know if the person I'm talking to now might be someone else at another time who doesn't follow the rules, Parrish said.	Parrish said he didn't know whether the person he's talking to now might end up being someone else.	3.4
5437	ffb39d99a077bae35480454ac	Many dead after asylum boat sinks off Australia	Mandela spends his third day in hospital	0.0
6440	e533dd24892202b1c9b840cbe	Coagulated egg proteins combined with gluten provide baked goods with the necessary supporting structure.	There are basically two main types of cakes: butter and sponge (or Genoise).	1.0
5569	db48715856ad625154e72b22b	A couple marries in the UK's first Scientology wedding.	A couple gets married in Britain's first Scientology-style wedding.	5.0
7054	8661d80d850d4fa01b97fe5d7	Soggy solstice: Stonehenge gets soaking	Summer solstice celebrated at Stonehenge despite rain	3.2
5187	eba7b09ab0f80a06a297bcdcb	Russian Prime Minister continues his visit to Crimea on his second day.	Russia warns against setting preconditions for Syria	0.8
1135	76c90841218704f39540292b0	A pot of liquid is at the center of a tinfoil-covered plate.	A pot of food is placed in the center of a beautiful red tablecloth.	1.4
395	0e6b52b0c156f0451bbf68c9a	A dog is bouncing on a trampoline.	A boy is playing the guitar.	0.0
1972	d484afcd842f97b5e45344898	A woman is sitting on a sidewalk, listening to a call on her cell phone.	A woman is riding her bicycle.	0.5
2321	0d17925aaa014be6977f90147	What does pressing the number one do?	Pressing the number one gives access to English.	1.6
762	ea5fc705651ca3070b8906b51	A woman is cutting flowers.	A man is holding huge sunflowers.	1.0
5236	9ea65e0a10f26376e888ac59d	Fire kills 38 in a Russian psychiatric institution	At least 38 feared dead in Russian psychiatric hospital fire	3.6
6340	5c06913b44539bd6c25953db8	There is an older man standing near a window.	A boy is near some stairs.	0.4
4594	faa77552683c29921966e01a2	China's yuan weakened to 6.2767 against the USD on Thursday.	China's yuan weakens to 6.1818 against the US dollar on Tuesday	2.0
7436	b93b82535e1ea6f861f0811bb	A woman is dancing near a fire.	A woman is cutting a tomato.	0.308
5520	5a6c94a8bead2ab92dae17a33	Venezuela expels three U.S. diplomats	Venezuela Expels 3 U.S. Diplomats	5.0
3141	b09fafb0a86524a9326e639ab	He planned to stay all day until the river crested, which was forecast for late last night.	He and the other lawyers planned to stay until the river starts receding.	2.4
5294	f4d4413cf4d782d3185963750	Gunmen killed 10 people in Philippine political violence.	Five people died in the Philippines volcano eruption	0.6
4591	fb8566a8c70b8a153a4c99c13	Credibility is at stake over Syria	Obama: Congress, international credibility is at stake	1.4
8206	bfe730037c6bb972a6b66881a	The dollar was at 117.85 yen against the Japanese currency, up 0.1 percent.	Against the Swiss franc, the dollar was at 1.3289 francs, up 0.5 percent on the day.	1.333
1078	b7298bf702cbdd126e2430b37	A woman posing in front of an apartment building in the snow.	A woman stands in front of a building in the snow.	4.4
2418	a2782d853ce84e62edd7d9a17	Originally posted by jacko !	Originally posted by IZZY !	1.2
3795	3de31becda91dc70ce096f167	ISAF: 4 coalition troops killed in attack involving Afghan police	"NATO says four troops killed in ""insider"" attack in Afghan south"	3.0
4313	2eb34cf92e31c1c3cc947ad64	Usain Bolt wins 200m – Steven Howard reaction	Facebook mobile's success drives revenue growth: reaction	0.2
3917	ca0c40883fcd2a1354e15ebc4	Five aid workers were freed in an operation in Afghanistan	Suicide bomber kills 37 at mosque in Afghanistan	0.8
3011	06a4345052cfda535439eb7ee	Linda Saunders pleaded guilty in federal court to six charges, including extortion, money laundering and conspiracy.	Former Phipps associates Linda Saunders and Bobby McLamb have both pleaded guilty to federal charges, including extortion.	2.75
1543	803a8469471e58d37d25fa9fe	A dog swims with a stick in its mouth.	A dog is running with a stick in its mouth.	2.6
3387	9ab50346a32e024bf1e625a19	Both are being held in the Armstrong County Jail.	Tatar was being held without bail in Armstrong County Prison today.	2.5
1608	c41ce862db3ad73d4c861cf4f	A dog shaking off water.	A dog is shaking off water.	5.0
2037	a7e83f65afb62bdf44baf6808	When did I equate homosexuality with a developmental disorder?	I compared homophobic attitudes to a developmental disorder.	2.6
5830	36c119f3f74c7f3395262cd22	A man is playing the guitar.	A woman is painting her lips.	0.0
5357	c32fa9e62bc1bbde5e98b985f	Stars pay tribute to Cory Monteith	Stars pay tribute to James Garner	2.2
2675	4bb0516de9f57a1c0b1657375	The Dow Jones industrials broke the 9,000 mark for the first time since December, with a gain of over 140 points.	The Dow Jones industrials surpassed the 9,000 mark for the first time in December.	3.6
2932	11a105a9ea725391f5f52eabe	Sorkin, charged with conspiracy to obstruct justice and lying to a grand jury, was to be tried separately.	Sorkin was to have been tried separately on charges of conspiracy and lying to a grand jury.	4.6
8319	b8916993a0d3546f5ea63de1f	According to Junya Tanase, forex strategist at JP Morgan Chase, Japan is expected to continue conducting interventions, but the volume is likely to fall sharply.	"Junya Tanase, a forex strategist at JP Morgan Chase, said ""I think Japan will continue to intervene, but the amount will likely be much smaller."""	4.733
6507	be438afa58605cf1ec444bc42	I suppose those are Greek tickets for archaeological sites or museums.	That's indeed Greek, it looks like a ticket to a museum or field.	3.4
8532	cd0f0ce9f67251e365074c40a	A Southwest jet landed nose-first	Southwest Jet's main landing gear landed first	3.6
1500	6fe263e767d1f10e24c2bb0e6	A black dog emerges from the water with a white ball in its mouth.	A black dog is walking out of the water with a white ball in his mouth.	4.8
1898	11fd08764c7d532b141209079	Two boys, one wearing a hat, are playing in a playground.	A boy with a tan hat laughs while sitting near playground equipment.	2.4
3217	e67dd87295d6bd64fa5ee755b	The only other person who had not been accounted for on Sunday was a man from Fort Worth, Texas.	Another man, from Fort Worth, Texas, was also missing.	3.6
252	160bbfaf15272a5081d1846d1	People get off a train.	A group of people get off a train.	4.6
3844	52552c3d41b5dee17719baa8b	Capello quits as England manager	Capello resigns as England manager	5.0
4947	087b96b6cbd866e3101ec7b0e	'Whitey' Bulger given two consecutive life terms	Whitey Bulger gets life for racketeering and killings	3.2
861	e345e09b5ad0046a5dc338ae1	A man is putting meat in a plastic bag.	A woman is carrying a wallaby in her bag.	0.4
3324	a0392b274b37bfb962adc254f	Ricky Clemons' brief, troubled Missouri basketball career is over.	Missouri kicked Ricky Clemons off its team, ending his troubled career there.	4.0
5773	1fe8ac685543b5daaaaeed203	A man is playing soccer.	A man is playing the flute.	1.0
558	d236701e5f191934dc47c404c	Two little girls are talking on the phone.	Two girls are chatting on the phone.	4.5
101	8fa4492863ce56bd8ff963210	A woman is cutting a leek.	A woman is mincing ginger.	2.2
1108	74ce1073b1fb45923eb715661	A group of river barges stands out against a backdrop of trees.	A young girl is wearing a bike helmet and stands behind a bicycle.	0.4
2829	c873b9bcf25f20ab84f79e398	Its legal representatives began meeting with plaintiffs' attorneys last week to discuss a settlement.	Attorneys for both the archdiocese and the plaintiffs started meeting last week to reach an out-of-court settlement.	3.25
271	f7cd7bcd063600e336a36d8c7	The man is shooting an automatic rifle.	A man is firing a gun.	3.8
5133	89c4819c17d074003cabe4c5f	Death toll rises to 29 in India's Mumbai building collapse	Death toll rises to 12 in Indonesia mine collapse	0.6
646	65b596dc0c68b25330972d8db	A man plays the guitar.	A woman is playing the guitar.	2.0
6702	5f05c17a2e0836a6f092f2f4c	Basically, the rule is to play the ball and not the player, until someone catches it.	It is fairly simple to understand, but harder to referee.	1.2
4525	18cf43c2fdd272ae04ea65f8c	Four US Air Force helicopter crew members were killed in a UK helicopter crash.	US Air Force helicopter crew killed in British crash	4.0
324	28c26050bdba4d48d3476c09a	The boy is stuck in the entrance of the doghouse.	A child is stuck in a doghouse.	3.75
141	c5a94eaf5be58c76d42b4c7c3	A woman is dancing.	A man is talking.	0.0
6665	5edc605d46e16c52a1707fecf	I disagree with Josh Bruce on some of his tips.	Research shows that sleeping after studying is a good practice.	0.6
8521	c890377b8087d4d63de5c5f96	Taiwan's economy grew 2.27% in the April-June quarter.	China's economic growth has rebounded to 7.8% in the latest quarter.	1.0
1033	a01a02f8ac1870fb2324e00e0	A group of sheep were grazing in a field.	A group of horses is grazing in a field.	1.6
3069	8f2a2417356161bdad8344ffc	People who have opposed these actions throughout are now trying to find new reasons to argue that it wasn't the right decision.	What's happening here is that opponents of this action are looking for new reasons to justify why it wasn't the right decision.	4.0
7335	8a31498766bc11e22e8b7f107	The polar bears fought over the kill.	Polar bears are fighting each other.	3.4
4222	4cbcd1c832c9a63039aaf1b00	Key says we missed a chance to visit a marae.	Key wants to extend his stay by visiting the Waitangi marae	2.2
5740	1a1d9cc6c1ca9af28f73f7800	Pakistan executions draw international ire	Pakistan protests repeated ceasefire violations by India	0.0
5639	bbf9ae9f76e545f37e7b6311b	The World Cup hit by new stadium death	A worker dies at the World Cup stadium	3.0
4031	363af79012cf0631fa78b3443	AL renews condemnation on Syria's violence	The US has decided to close its embassy in Damascus due to the alarming security situation in Syria.	1.6
6923	8038da6010bdd53d2015d1dd6	Bulger's brother is now on the agency's '10 Most Wanted' list, suspected of being involved in 21 murders.	"Bulger's brother, a former FBI informant, is now on the law enforcement agency's ""10 Most Wanted"" list."	3.25
5568	6115052ed0e5993d96ea26ab9	Egyptian protesters refuse to end their sit-ins despite government threats	Egyptian protesters defy government threat	4.0
8355	d15894051e5442bc4bc559c79	She was taken by ambulance to Charing Cross Hospital in Hammersmith.	She was taken to Charing Cross Hospital, where she spent the night in a critical condition.	2.8
7744	1b9ec4cf814876c3763d354ee	A black and white dog dashes through the water.	A black and brown dog runs through a field.	2.0
1447	414b379675579bb1b9fb14345	A couple is raising a baby.	Couple with a brand new baby.	4.2
1239	22d90877174fd42336251a5b4	Three bottles are on a table.	An old green bottle is sitting on a table.	2.4
4836	e09f2925565d51ad50e6ad2b6	China's new PM rejects US hacking claims	China Premier Li rejects 'groundless' US hacking accusations	5.0
818	aa47d774c0c5fafbccc3d3ff3	A man is eating.	A woman is rock climbing.	0.0
1226	347748f29438332db7e9875f3	Two men are sitting on a couch, holding beers, with a girl lying on their laps.	Two women are watching the street with their bikes to see when they can cross.	0.0
8225	7d785088c770f96637192c6be	She was the only woman in her unit and a member of Teamsters Local 995.	She was the only woman employed as a warehouse worker and heavy equipment operator within her Teamsters local.	3.25
4150	8dbcd0e24304e25db18629867	Putin claims victory in Russia's presidential election	Putin claims victory in presidential vote	4.2
2592	9621acc805b8f96c8f08be5c9	Several relatives of Australian victims of the attack were in court to witness the proceedings, but few Balinese attended the trial.	Several relatives of Australian victims of the attack sat in the front row of the court, but few Balinese attended the trial.	4.6
3485	c75294e2debaa53c473dafe9e	Anatoly Sokolov announced that the Soviet-built A-135 missile defense system around Moscow is obsolete and inefficient.	The Soviet-built A-135 missile defense system around Moscow is obsolete and inefficient.	4.6
327	c126720180ad3b56b46cb4fa0	A man is playing the guitar.	A woman is dancing.	0.2
2458	d3dc7a721303e2d67df460d29	Butterflies exposed to an earlier light cycle, from 1am to 1pm, orientated themselves towards the south-east.	But butterflies that lived under an earlier light cycle, from 1 a.m. to noon, flew towards the southeast.	4.6
267	e8cb8685b28576dc603739f6e	A man is strolling along a path through the wilderness.	A man is walking down a road.	2.5
3200	a28242532b2a08f6ce936a769	Caldera acquired the Unix server software of SCO and renamed it to SCO Group.	SCO changed its name to Tarantella, and Caldera later changed its name to the SCO Group.	2.6
6252	3d47ad5f58813dd493535c1a2	The young boy jumps barefoot in the front yard.	A teenager rode his bike around people walking in the courtyard.	0.4
2923	508b48910091d8d84bad6e7e4	The Ministry of Defence is facing a 20m compensation claim from hundreds of Kenyan women who claim they were raped by British soldiers.	Hundreds of Kenyan women who claim they were attacked and raped by British soldiers received government legal aid on Wednesday to pursue their case against the Ministry of Defense.	3.0
8145	1f2fa0b44c5cf1cdeb4049e12	His 1996 Chevrolet Tahoe was found abandoned in a Virginia Beach, Va., parking lot on June 25.	His sport utility vehicle was found June 25, abandoned without its license plates in Virginia Beach, Va.	3.6
802	ca6cc13fb4b6d1368e7238249	A woman is peeling a pineapple.	A woman is cutting a pineapple into small pieces.	4.0
3232	4da63d14e8adf9f71ffdc574f	Five-time Tour de France winner and cancer survivor Lance Armstrong offered some advice to other cancer survivors in Denver on Friday.	Five-time Tour de France winner Lance Armstrong is in Denver today discussing his battle with cancer.	3.4
5629	365e956fa50dedcd58bd9e546	Police surround protesters in Belfast ahead of G8 summit.	Peaceful anti-G8 protest held in Belfast	3.0
3112	d7747517fdb23a7d4d99f0394	Apple Computer's new online music service sold more than 1 million songs during its first week of operation, the company said Monday.	Apple Computer Inc. said Monday it exceeded record industry expectations by selling more than 1 million songs since the launch of its online music store a week ago.	4.6
4145	64fa02104eae9b91d83a5cca7	Donna Summer, the Queen of Disco, died at 63.	Donna Summer, the undisputed queen of disco	3.0
3556	fce2564ec6f00359ac4b6b308	The Tunisian plan aims to establish electronic databases to improve tax collection.	the plan for Nigeria and Mozambique is to create an electronic database for real estate	1.8
1771	d6382994db0fa91634bf4faee	The woman holding a black purse is smoking a cigarette.	A woman carrying a black bag is smoking a cigarette.	4.8
5130	140a3534171c46097ae08e6e8	France to ban child beauty pageants	Facebook is testing its mobile payment service.	0.4
1107	158cd180cb4e5611c31fa2121	A red double-decker bus is parked on the side of the street.	A red double-decker bus is on a city street.	4.4
1542	86bfbe6884ac24fb83a1b84e9	Two big dogs running in some grass.	Two brindle dogs are running in the grass.	4.2
2990	a2a69c3e1bbaef5135ebe4bf0	Strayhorn said it was the first time in Texas history that a comptroller had not certified the appropriations bill.	In a press release, Strayhorn said it was the first time a comptroller rejected a budget.	3.2
7563	6afa8605729a52999bdb59244	Home office space with bright green walls and artwork.	An office with multiple desks and green walls.	3.4
575	fd0d2bdb3d7d45dc316618f48	A girl jumps on a car.	A girl is jumping onto a car.	4.8
6540	84ab167a474d8ed8ec5b91f66	I visit AZ every summer and take some hikes in the desert when I'm there.	Apart from what has been said, your water consumption also depends on what you eat.	0.2
2892	b0812a451bbf614ecd6297a62	It's hard to underestimate the enormous risks associated with the Remote Procedure Call (RPC) vulnerability.	The flaw involves the Remote Procedure Call (RPC) protocol, which handles inter-computer communications.	2.5
5149	2647234d4bba549fe288442d7	Hong Kong stocks end higher	Indian stocks open higher	0.6
7683	14c550337708792c293a3c126	A red-haired woman in black is posing for a man who is resting on a tree.	A man in a black shirt is holding a child wearing sunglasses.	0.0
2785	c70c04643364475be2e68fd2d	He was voluntarily castrated in 2001, he claims, which removed his ability to experience sexual arousal.	DeVries, who chose to undergo voluntary castration in August 2001, said the surgery eliminated his sexual arousal.	4.5
32	23468cd3d74f3a3b0d67c4df6	Women are dancing and singing together.	A woman is dancing and singing in the rain.	3.0
7961	7762f652c2b154202e5897b95	The most important thing you can do is to know your stuff.	The best thing to do is to overcome one's fussiness.	0.0
1810	38edccc6dc9d0549b233ad1f6	A girl bounces upside down on a trampoline.	A girl is bouncing on her head on a trampoline.	4.8
3446	31550ab33d9b3f0eabeaa6863	The defense cannot appeal Roush's ruling until after the trial.	Defense lawyers cannot appeal the ruling until after trial, in the appellate courts.	3.4
4099	67af682757fc759f74dd06b90	Four French soldiers were killed in Afghanistan.	A British soldier was killed in Afghanistan	1.0
62	6672c91268517eeb8e6fe76c1	A kid plays with a toy phone.	A little boy plays with a toy phone.	3.5
5457	4e3c2717373037be6ebc0490b	Israel frees a second group of Palestinian prisoners	Israel releases 26 convicted Palestinian prisoners	3.8
3470	c714cbbca1fa89a64307d9149	Reports state that the Syrian government was concealing a nuclear facility at the attacked site.	UN experts have begun analyzing reports suggesting that the Syrian government was hiding a nuclear facility at the targeted site.	4.2
4607	b17a7402b2048f751539231c5	Manning was sentenced to 35 years for leaking government secrets.	A British man was sentenced to 10 years in prison for selling fake bomb detectors.	1.0
3907	cbf67a78c25b7e6acceec0e69	Clinton calls on Syria's friends to unite	A plastic artist calls for greater support for emerging new talents.	0.0
58	fe6602f4e8d2a6a5b3e67a4c2	A woman is riding a horse.	A woman is riding a horse.	5.0
7137	7a8c2cb073fee5c64c82a9648	Turkish police mass near Istanbul park protest area	British police deny having protected sex abuser Savile	0.0
7316	6d6d1b8993fa91d738da92e69	A man is sitting and smoking.	A man is smoking a cigarette.	4.0
6350	b89c7b9c78c391ddff3f37b4b	A helicopter is getting ready to take off.	The plane is getting ready to take off.	2.8
7860	0033cac6aa69cc082280fc646	A group of people are anxious about crossing the water.	A group of people is on the water.	2.2
3198	fd8fdf2c5c80e152b3b8a1dca	Agents found more than 1,000 credit cards and credit card duplicating equipment during a search of Ragin's address.	When Ragin's address was raided, authorities found more than 1,000 credit cards and duplicating machines.	4.8
2218	3b73259f89351a3f21cb235b1	I'd be willing to offer Iran a deal.	I think Chuck would accept a deal with Iran.	4.2
3003	d23cde63817972e1e92e40191	Last year, he failed in his bid for the Democratic nomination for governor.	He ran last year for the Democratic nomination for Texas governor, but lost the primary to multimillionaire Tony Sanchez.	3.25
5932	facc398cfa5698c1d3c8f7009	A man is playing the flute.	A man is dancing.	0.2
7893	3e677721605203a7e196443c1	You just have to base your answer on what you know, which is what you want.	It depends on your choices for what you'll do next and where.	1.0
816	fe91679629fe287b35d1e39f0	A man is opening a box using a knife.	A man is playing the guitar.	0.0
5875	e45a9224f613090f303d91471	A man is cutting a potato.	A woman plays an electric guitar.	0.083
8324	d2f0fb3ba1103c7a9354db6d6	"Edie Falco was also the acclaimed co-star of the film ""Frankie and Johnny""."	"Edie Falco was not nominated for ""Frankie and Johnny."""	2.4
1225	2ec72b3844fb0b1dfc76917e3	Red double-decker bus picking up passengers.	A red double-decker bus is taking on more passengers in a city.	4.4
3245	dd1774e1bc59bc29a3a5dd04e	Rambus Inc. (nasdaq: RMBS - news - people) was another big gainer, with a 32% increase.	Rambus Inc. (nasdaq: RMBS - news - people) surged 38% and was the biggest percentage gainer on the Nasdaq.	3.0
6450	4ead9303ecb20d6cb36c81c03	If I understand you correctly, you are looking for a term that encompasses inclusion and exclusion.	Inclusion is the act of including and exclusion is the act of excluding.	2.6
4357	21ad7c80542b01ba1f3575bd6	Yvette Cooper backs gay marriage bill	The White House backs gay marriage	2.6
693	7a264d01e07cde6ffd4a7e6c1	A man is playing the guitar.	A cat is playing.	0.4
5605	39527e0617a427b4d71bcf544	Spain adopts a new more restrictive abortion law.	The Spanish government has approved tight restrictions on abortion.	5.0
462	f7368ea76834239ded23acb03	A boy takes off his sunglasses.	A boy is screaming.	0.5
