	id	sentence1	sentence2	similarity
5354	d48ab5171302ac4dc2619170a	Cairo protesters resist the crackdown threat	Protesters settle in and live on in Cairo Camps.	3.6
2251	a8609811a1eba03275189433d	As you wish: Do you see Hitler killing Jews?	Do you see Hitler killing Jews?	4.6
3321	35f791563733af1ef6ef5f0d1	Ray Brent Marsh, 29, faces multiple counts of funeral service fraud, making false statements, abuse of a dead body and theft.	Ray Brent Marsh, 29, is also charged with abuse of a body and theft.	3.8
3434	ed2a55839033fb3931ae3125f	LURD also called for an interim government and the deployment of a U.S.-led Western peacekeeping force.	The rebels are also calling for the deployment of a U.S.-led peacekeeping force.	3.0
1874	8e82141e006401bddb4701e23	A woman dressed in green is playing with her golden-haired dog.	A brown dog licks a little girl's hand while lying down.	1.6
5487	d0a9ff133adf412622d430b71	World News Update, what you need to know	Labour's 50p tax rate: what you need to know	0.6
1929	4db784181e0a080325b13a228	Children engage in sword fights.	A child and their parent pet a horse.	0.0
7445	e18b5ffd9cfc244918b1b4903	The people are lifting bags.	Several people are carrying large bags.	3.75
480	71ccd055dabb2668a4895e288	Someone is petting a monkey.	A man is holding a slow loris.	1.2
7379	931e30d9cce57c2863a02bbfd	Two men are playing football.	Two men are training football.	3.4
2977	a001ba5ce302277dfabfed3d6	Boeing said the final agreement is expected to be signed within the next few weeks.	According to Boeing spokesman Bob Saling, the Korean Air deal is expected to be finalized in the next several weeks.	3.0
5619	ca3d4b78d0705e26809cbc4e7	Sony is to sell its PC unit and cut jobs	Sony is to axe its PC unit in major business overhaul.	3.0
8495	eb57434ba0bfa83b29a9d1998	A man who battled the Fukushima nuclear disaster has died of cancer.	Former plant chief who battled Fukushima disaster dies of cancer	3.4
615	9713acdbcb70945b1966efdd0	A man cut a bunch of water bottles with a knife.	A man is cutting a row of water bottles with a knife.	4.4
5365	6573fc03fa691f10aaa1a4a57	Strong new quake hits battered Pak region	Powerful new earthquake hits battered Pakistan region	5.0
7597	b44c7b8d9622e2c56d173d7dd	An elderly man works on his computer at home.	An older gentleman is sitting on the couch with a laptop.	4.2
1000	237fc911cb3a430a1a2250232	Two green and white trains are parked on the tracks.	Two green and white trains are on the tracks.	4.4
4492	affe970878e7b22344545e96d	Obama meets with the Mandela family.	Obama meets Zuma and pays tribute to Nelson Mandela	3.0
3663	819e47cd5b43e397d5cde444d	The OSCE discussed the possibility of extending its mission in Kosovo.	The OSCE discussed Kazakhstan's bid to hold the OSCE presidency in 2009.	2.2
4212	0335dfc7580b597f7bc453a33	Police raise death toll in bus accident to 8	Rodney King's death was ruled accidental.	0.4
7125	4eb363a796d8034a879fdb4de	No radiation leak has been reported at Iran's nuclear plant	The US Congress may disrupt the Iran nuclear deal.	0.8
1571	ca91d24bdd85a85a68f8e2374	A boy jumps into the turquoise pool water.	The young boy is jumping into the pool on his stomach.	3.4
4308	1401092e8537c9ba95fa389a2	The Red Cross is negotiating a ceasefire in Syria to deliver aid.	The Red Cross is negotiating a Syria ceasefire to bring aid	4.4
2784	19e9f913d9eeb20638bcb48fd	The law firm representing Torch Concepts, Rich Marsden, did not respond to repeated phone calls.	Officials with Torch and JetBlue did not respond to repeated phone calls from the Mercury News seeking comment.	2.75
6670	83441c5db68d2a2fe9f85311d	Some studies suggest that open-space environments might reduce working efficiency by 2-10% due to interruptions, stress, and ambient noise.	There's an iPhone app called Groups which might be helpful.	0.0
4966	26ee505ffd00da96e9b887b5e	The NA President's message on World Press Freedom Day	Pakistan marks World Press Freedom Day	2.2
6170	157610d6062806e8fc8aa2b79	Three dogs were having fun in the dazzling white snow.	Two dogs were having fun in the grass.	1.6
6165	181642b57b35a271fafb8d5a2	A man and a woman blow bubbles.	A man and a woman in glasses blow bubbles.	4.2
5356	decf214598f8c14ad80977b4f	A Malaysia Airlines official briefs relatives of missing flight passengers on search progress.	Malaysia Airlines is investigating the co-pilot of the missing flight.	1.0
7792	e836522d1584c3f3285a4e085	A dog is hiding under the stairs	A dog is resting on the stairs.	2.2
2395	634ad85fa55cf4fd37f16e45e	No, I'm showing you that you're willfully ignorant.	Haha, you're really ignorant.	4.0
7461	12d6c864b887151cca1e06fa5	The man is mixing whipping cream.	The man is holding a skunk.	0.0
5494	dbec81f4a9c9cdce59291bd74	A bomb blast rocked a shopping mall in Nigeria, 12 killed	Bomb blasts before Indian opposition rally kill 4	1.4
706	bd4a0d6a681cd9c3640f58a46	A person is cutting slices of bread.	A man is slicing bread.	3.2
6022	b93424dec1a1e3e54f6f5f3d2	Two planes are flying in the sky.	A plane is flying in the sky.	2.4
3085	539ffb5cf0d729ff3572fadf0	The ADRs fell 10 cents to $28.95 at 10:06 a.m. in New York Stock Exchange composite trading today.	Shares of Fox Entertainment Group Inc., News Corp.'s U.S. media and entertainment arm, fell 45 cents to $26.85 in New York Stock Exchange composite trading.	1.4
7073	2d37133f94113c7b217da73e4	Venezuela's Chavez is in Cuba for his 3rd anti-cancer treatment.	The Venezuelan leader is returning to Cuba for treatment	3.2
3838	e4846e00989999fedc0bfce07	India banned bulk texts after riots	Tunisia lifts curfew after riots	0.8
2969	4405648d0e909af9b08067f6f	According to church members and observers, the decision could be problematic for many Episcopalians.	But church members and observers say they anticipate that the decision here could pose theological problems for some Episcopalians who consider the Bible condemns homosexuality.	3.8
1607	9b5e09e750bc2231ea5ebced4	An infant sitting on a cot reaching over to touch the face of an older boy.	A boy who appears ill is gently touched on the face by a toddler.	2.2
85	16b3498faa03f2b702821c37c	A woman is cutting tomatoes.	A man is chopping an onion.	1.6
2915	3a4eba87138c8bbcee777db67	"""This moves us a lot closer to saying that the foam can do this kind of damage,"" said Hubbard, a member of the Columbia Accident Investigation Board."	"""I think this moves us a lot closer toward saying that foam can do this kind of damage,"" Hubbard said."	3.6
3463	0abb888468bf43fb80b1088d3	Brazilian police are surrounding slums north of Rio de Janeiro to rid them of violent drug traffickers.	The police officers surrounded the slums north of Rio de Janeiro to rid them of violent drug traffickers and seize weapons and drugs.	3.8
6657	88c058d1ddf3b28308d9ef566	Even though the question has been answered, I would like to add my answer.	I'm not sure if I should tell you this, but if your job is making you anxious.	0.0
2918	8c05017705291febf8d981075	The Treasury plans to implement a system allowing retail buyers of all Treasury securities to manage their holdings online in a single account.	The Treasury announced its intention to allow retail buyers of all Treasury securities to manage their holdings online in a single account at some point.	4.4
5371	2b74ce1c6074a089d27869222	Chinese shares closed higher on Tuesday	Chinese shares closed lower on Wednesday	2.2
2031	c8b9c7fd2c95f5c80dcd410c9	It still makes no sense.	It's you who doesn't make sense.	1.4
3779	cb118fff0f27bdb3d8819218b	Stocks rise early after Greek deal, then flatten	Stocks edge higher after Greek debt deal	3.6
4160	371027add60fe96aa09eddc32	An Israeli military court rejects the appeal of a Palestinian hunger striker	Israel reaches deal with Palestinian hunger strikers	1.2
7829	8d986918e657367483434b19e	The child's bike got wet.	She is putting away the bike.	1.2
7020	4d900e2fa123f4afbbe5b2b49	Russia, China vetoed UN resolution on Syria in favor of	Russia and China vetoed a U.N. draft backing an Arab plan for Syria, Reuters reports	3.8
6836	ce98e781690df1549033807ea	The broad Standard & Poor's 500 Index rose 8.79 points, or 0.96 percent, to 929.06.	The technology-laced Nasdaq Composite Index <.IXIC> rose 26 points, or 1.78 percent, to 1,516.	1.0
444	73a4e08e5490f22032a3bbd97	The rhino grazed on the grass.	A rhino is grazing in a field.	4.0
6455	d0f4e9f1df7e3d2a2efcce6ab	I'm American, and I've never heard of a bathroom referred to as St. John's.	In situations like these, I tend to stretch out my sentences.	0.0
486	b3e4eb73b123f1868288c1cb4	A man is smoking.	The man sat in his suit and smoked.	4.0
2508	5872cbd8596cf7bd418b78288	A three-judge panel of the 11th U.S. Circuit Court of Appeals ruled late Friday that the small size, limited use and secular purpose make the image legitimate.	The 8th U.S. Circuit Court of Appeals overturned a ruling from last year that had supported the ordinance.	2.8
8162	df88efec98a65b16c355a0d21	A captured rebel said more than 2,000 insurgents were involved in the attack.	A captured rebel said 2,100 combatants had been involved in the offensive.	3.5
4168	0d3584bf40c76b506078d743e	George Zimmerman is accused of killing Trayvon Martin	George Zimmerman to be charged in Trayvon Martin case, official says	4.0
8277	aa2d0026bc126a029be2daf03	Further testing is still ongoing, but given early detection, the outcome would be positive in such cases, the specialist said yesterday.	At this stage, given early detection, the outcome in such cases would be positive, he said.	3.5
6994	b35cf3bd89e475635dcfe991c	"A Merrill Lynch spokesperson said ""we are delighted with the judge's decision."""	Merrill said yesterday he was very pleased with the judge's decision.	4.4
6382	fc22e82aef93af1d405d55dc5	In general, there are several distinct workflows that lead to a poster.	For completeness, Apple's Pages offers several pleasant poster layouts.	0.6
67	8f015fc1c8daa66b02cd3e9fe	A man is getting into a car.	A man is getting into a car in a garage.	3.833
4466	f6b2765ddb385dfdef784f2dd	Investigators received new information about the deaths of Princess Diana and Dodi Fayed, which allegedly includes an accusation that they were murdered.	The police have received new information on the deaths of Princess Diana and Dodi Al Fayed and are re-examining them.	3.5
2235	2e7b5787652e33c87df2afa3b	A billion people are enjoying Mexico's current prosperity level.	Most people in Northwest Africa are currently at a prosperity level.	1.53333333333333
5162	8d3674fd5ed3cc40480c90d96	The son of popular US evangelist Rick Warren, a well-known figure, has committed suicide.	Son of popular US evangelist Warren kills himself	4.4
2186	06250ed983e6fc55b3bd73988	h and i both read the books and thought the movie moved so quickly.	I haven't read the books, but I saw the movie today.	3.0
6308	7e598766d3b539d0d0f09a861	The child would like to swim.	The children want to swim.	3.8
3447	6d54fe5cdf1e7b605fb871b38	The committee was designated by Defense Secretary Donald Rumsfeld under instructions from Congress.	The public hearing is the second held by the panel created by Defense Secretary Donald Rumsfeld in response to pressure from Congress.	2.6
3773	ed0d88aa1da910e1d943a8243	The Saudis will allow women to compete in the Olympics.	Saudi women are allowed to compete at the Olympics	4.8
7432	6b303c0c168fbae38a7e195e2	A man is exercising.	A man is firing a rifle.	0.5
6809	89493039316b7905005f001f5	Dotson was arrested Monday in his native Maryland and charged with murder.	Dotson, 21, was subsequently charged with Dennehy's murder.	3.2
746	309ae1712493a2d610528207a	A man is placing two paper towels on a paper plate.	A man is placing documents on a plate.	2.2
7019	3ed7f270586185e1e96a3baf5	Civilians bear the brunt of Afghan attacks.	The Taliban launched a series of coordinated attacks in Afghanistan.	1.8
2475	7d95aa51619974d67b9b90e39	It can store more than a gigabyte of information equivalent to around 12 hours of music in a small cube.	And it can store more than a gigabyte of information, equivalent to 1,000 high-quality images or 12 hours of music, in just one cubic centimeter.	3.846
172	04902b3524a8aeda539701142	Two baby pandas were playing.	Two pandas are lying together.	3.0
710	c2621a12571a24cbd82f55512	Someone is cleaning an animal.	A woman is cleaning a shrimp.	2.8
3118	eaf700b0fcf73ef8ecb7d7677	The monkeys followed their advancement by observing a schematic representation of the armature and its movements on a video screen.	The arm was stored in a separate room, but the monkeys could track their progress by watching a simulation of the arm and its movements on a TV screen.	4.0
923	d0b814506f673f92619a5e160	The man played his guitar.	A guy is singing and playing his guitar at the same time.	3.0
2868	0b6234732a76b1bf0185df8ee	But the prime minister told the BBC he wasn't concerned by polls and that he would stick to his principles.	He said he wasn't bothered by polls and that he would continue to do what he believed to be right, in both foreign and domestic policy.	3.4
7195	ca16c9f8cd729863cbdea78a1	Obama signs law aimed at excluding Iran's UN envoy	Obama urges no new sanctions on Iran	1.0
4047	de6ad7117da04e8072bacad6b	Iran may cut oil exports to more EU states	Iranian MPs say ready to ban oil exports to some EU states	3.6
618	9a7ec0910a065b02ae7e0f34b	Someone is making a bed.	A person is eating at a table.	0.2
1114	8129f74b6782ad8cfdbe9ee52	Four people are rowing a boat near the shore.	Four people are on a boat on green water.	2.8
7549	7951d8cd607b14aef1aa22a10	A red and white bus drives down an English street.	A red and white English bus drives down the street.	4.4
803	bf1cfb5386890dc4852e09d4c	A woman is seasoning a piece of meat.	A woman adds ingredients to beef.	3.75
2209	f358f607eb017466f5444ac0f	Despicable Ben, stop trying to find excuses for the man.	Ben, stop making excuses for that man.	4.4
5425	dbdaffa44c4c86e5fc71a19b6	A Chinese tourist was abducted from Malaysia	China returns 10 Vietnamese children abducted.	1.4
5389	69324bcf2a1442838feb06a1a	Russian coal mines are seeking new markets in China	The Russian foreign minister will meet the UN chief.	0.4
3441	5ed2bff35473023f4ebc97fbb	However, other unions, including the powerful CGT, refused to back the reform and demanded new negotiations with the government.	The powerful CGT and other unions continued to oppose the plans, however, and demanded the government revise the reform with them.	4.0
7544	c6ab60362a5ff93ae7c5d200e	A little girl is laughing at the camera.	A white cow with enormous ears is staring at the camera.	0.2
4331	1875ad74a0f16c4f97c27c6bd	F1 protests took place in Bahrain	A day of fury erupts in Bahrain	2.25
8257	01d7eda7c620511906b19ff41	Hilsenrath and Klarman were each charged with three counts of securities fraud.	Klarman was charged with 16 counts of wire fraud.	1.4
2700	bd75df64e7b1ec55b486fd352	Schools that fail to meet state goals for three years in a row must offer tutoring in addition to transfers.	Schools that fail to meet testing goals for two consecutive years must offer transfer options.	2.75
4619	6ea28c601eeb85e2e341a1382	The US State Department was faulted over Benghazi	The State Department's security chief resigned after Benghazi.	2.4
1868	24fe9f8eff8b031ee486aa267	A man is standing on his bike on a rocky trail alongside a lake.	A woman is wearing a white headband, a purple tank top, and black gloves.	0.0
8234	85c95a8401dc642c4389d6a1f	Indeed, Mr. Weill, a self-described workaholic, said he planned to remain very involved in the company.	Still, Mr. Weill will remain a highly influential figure within the company, even after his departure.	3.2
8253	51e9636a40ad0c210c26474af	Graves reported from Albuquerque, Villafranca from Austin and Ratcliffe from Laredo.	Pete Slover reported from Laredo and Gromer Jeffers reported from Albuquerque.	1.25
1985	aed947f96ba1bc0674f2d3fa6	A group of people are strolling along the sidewalk of a big city.	A group of people are traveling in the back of a truck.	1.0
5929	83b26763b4b9563272921dc42	A woman is applying eye shadow.	A woman is washing a bowl.	1.2
1066	e009bccb56d9a0f28fc571334	Five birds stand on the snow.	Several cardinals stand in the snow.	3.8
6635	ecb746f817f0fca2b72a1d87a	The president is not essentially important for the Germans.	The role of the German president is largely symbolic.	4.0
7687	d5d35c2bb7b03b88c738c53b6	A black dog is jumping out of water.	A black dog is shaking off water.	3.0
4682	ee8af72d8b0c12e58c5e9f0ec	At least 45 people were killed in a train crash in Spain.	At least 13 people were killed in three car bombings in Iraq's Diyala province.	1.0
986	4cb9175f7f1574b759552c9c6	A girl is cutting a butter into two pieces.	A woman is mincing tofu.	1.0
3886	e60a107a51df4631d4269e606	Former Nazi death camp guard Demjanjuk dead at 91	John Demjanjuk, a former Nazi concentration camp guard who was convicted, has died at the age of 91.	4.6
8315	7f74f9822d7e4fe7cf1abbb5c	The government did not reveal the identities of the taikonauts, these Chinese astronauts who would embark on the second mission.	The government failed to identify the taikonauts, a term coined from taikong, the Chinese word for space.	3.333
3593	13ca9e470508fc9d2e74e706e	The conventional forces in Europe treaty is considered a major arms control agreement.	The Conventional Armed Forces in Europe Treaty was a major Soviet-era arms control agreement.	4.0
5915	3b5151c00705612e76d81a412	A lion cub tries to climb a fence.	A lion tries to climb over a wall.	2.75
6092	a1f1f6634520db3f83ebb55d8	A close-up of a brown horse.	A close-up of a horse.	4.0
2625	a4e872438db795de68bc53f1a	Iraqi police opened fire in downtown Baghdad today after protesters stormed a police station demanding jobs they claimed to have bought with bribes.	Iraqi police opened fire in downtown Baghdad Wednesday after demonstrators demanding jobs stormed a police station and threw stones at officers, police said.	3.25
5503	96c8426008483aa99db8e55d3	The US believes the Syrian government deployed chemical weapons.	US suspects Syria used chemical weapons	5.0
1103	5a92880116b6e1373e6fc2cb3	A boat with four sails is sailing on water.	Sail boat is gliding on the water.	3.6
7416	0b945b545c56c4596791d6ce6	Someone is reading an email.	A man is reading his emails.	3.4
5014	4a7c1a9f77da0a287b27f14ab	The world's oldest man has died at 116.	World's oldest ever man dies at 116.	4.6
981	74e675c185054f7b11d52da6f	Someone is chopping an onion into water.	A person grates a potato into a bowl.	1.5
7650	3b5d5b3bba86b05f7912ff32b	A woman wearing a black and orange jacket throws a stick for her brown and black dog to fetch.	The man in a blue jacket is standing in a crowd.	0.0
6195	a6e0444bae70a7d369b4a27e3	A woman stands with her arms out at her sides while another takes a picture.	A man stands in a crowd holding a white object.	0.4
7064	293a8d03aac33fddf4ce1bee4	Romney leads his rivals in fundraising, except for Obama.	Romney said he left all management of Bain in 1999	0.8
4986	23ea2e0e58d2caf4c8cff114e	The US restarts search for missing British sailors after a public appeal.	The US Coast Guard has suspended the search for missing British sailors.	2.4
5045	828225e45ead0dca81264c725	Shooting, protests mar Thai voting	Thai protesters disrupt advance voting	3.6
161	7f3acfae4fba06a73af0d1103	A man is playing the guitar.	A man is hitting a target.	1.2
6465	7dcc629cabbc62f49dc6c8e37	If you know yourself and your opponent, you will be more likely to win any battle.	Another meaning behind this quote, aside from the probabilities of winning a theoretical battle, is the importance of understanding others.	2.8
8136	bcf1d56a6eb722a3bb9b1ffe1	The AFL-CIO will wait until October to decide if it will endorse a candidate.	The AFL-CIO announced Wednesday that it will decide in October whether to endorse a candidate before the primaries.	4.0
845	c3f5befa4df21edfaadf66813	A man is peeling a potato.	A man is hiking.	0.5
2544	b22749fb7d2c59f158e7cccba	The 3 hours of recordings include conversations between police, firefighters and other emergency workers, as well as media inquiries.	Among them are conversations between police, firefighters and other emergency workers, as well as media inquiries.	3.6
2864	08eb73af692b75255d5f3db44	Federal Judge William Barbour said Tuesday he sentenced Avants to the maximum term because he showed no remorse for the brutal killing.	U.S. District Judge William Barbour said he imposed the maximum sentence because Avants showed no sign of remorse.	3.6
2641	28a5b2d314825e43724da5dd0	Advancing issues outnumbered decliners about 8 to 5 on the New York Stock Exchange.	Declining issues outnumbered advancers slightly more than 3 to 1 on the New York Stock Exchange.	2.2
6798	f110698477a2e33f7e1e5e6cb	Earlier Thursday, PeopleSoft officially rejected the unsolicited bid from Oracle.	Thursday morning, PeopleSoft's board rejected the Oracle takeover offer.	4.4
5448	04c5f794d6c32eb2916765a83	Obama announces the creation of twin manufacturing hubs	US stocks retreat on manufacturing data	0.4
4431	a92833b40959b8f8aeb178e48	Mexican singer Jenni Rivera believed killed in plane crash	Mexican music star Jenni Rivera dies in a plane crash.	3.4
6992	c1d2a3ca92220ef84870f129c	The commission dropped charges that Patton improperly appointed Conner to the Kentucky Lottery Board and that he improperly appointed Conner's then-husband, Seth, to the Agriculture Development Board.	Patton also designated Conner to the Kentucky Lottery Board and Seth Conner to the Agriculture Development Board, the commission says.	2.5
2959	89c0428484fe42b97dfa12896	Jim Williams, director of the US-VISIT project, stated that by mid-November, most arriving passengers in Atlanta will be identified and photographed.	Jim Williams, director of the US-VISIT project, said that by mid-November, inspectors will be fingerprinting and photographing many foreign passengers arriving at Atlanta's airport.	4.2
2929	e224706c0fedd6fca14be85d5	The technology-laced Nasdaq Composite Index <.IXIC> gained 5.91 points, or 0.29 percent, to 2,053.27.	The technology-focused Nasdaq Composite Index advanced 6 points, or 0.30 percent, to 2,053, erasing earlier losses.	3.2
5665	1d1d38b1aa187a10cc43a0b30	Saudi-led airstrikes hit Yemeni capital	Saudi airstrikes in Yemen's capital kill 29 people.	3.0
885	27d30f5c35331bf8882664c03	A man is on the phone.	A panda bear is gnawing on a stick.	0.0
7766	67bad25f5bffa875e88e8138f	A woman drives a golf cart.	A man is driving a cart.	1.8
7053	9ca124d71b4f28842c024cb3f	Manchester United slashes price for US IPO	Manchester United reveal share price details	2.4
6973	f72b2827693cded50a061e036	Former South African Archbishop Desmond Tutu said Sunday he didn't see the point of the fuss over appointing a gay bishop, but urged homosexual clergy to remain faithful to their vocation.	South Africa's Nobel laureate Archbishop Desmond Tutu says he doesn't see the big deal about appointing a gay bishop, but he's urging homosexual clergy to remain chaste.	4.5
1063	f0eca35c00402e0ada9abf387	A striped cat is lying on a cat litter bag.	A domestic cat is lying on the back of a cat litter.	3.8
5730	cace92274c6dc1fb345c88ae7	Hong Kong officials resume work as protests thin	Hong Kong student leaders consider a protest retreat	2.0
8429	22279adf4ea90cbe4e047abe7	East Timor is participating in the presidential election.	Venezuelans are called to vote in the presidential election.	1.0
43	042cc7992c816e6505a57e232	A person is slicing a tomato.	Someone is slicing some meat.	1.75
3411	4c246034eb43278338513578c	Stanford (51-17) and Rice (57-12) will play for the national championship tonight.	Rice (57-12) and Stanford (51-17) will meet in a winner-take-all matchup at 6:05 p.m. Monday.	3.5
4033	0918ba8daa5f5d9b7e44f5350	Air Force Instructor Faces Sentencing for Rape	Women testify at Air Force instructor's sentencing	1.8
426	76cf17a0799b828b4ae462cfd	A man uses a knife to sharpen a pencil.	A woman is letting herself be swept away by dancing in the rain.	0.0
4476	6372b074ada1bf015f2f6d66e	China stock index futures close higher -- December 4	China stock index futures close lower -- January 24	2.2
7788	1ba06c362561310bda721ad41	A man enjoys popcorn while watching cartoons late at night.	A man and a girl are watching cartoons at home	2.8
5102	2e6e2719e8d87fd349ffba829	East Ukraine Separatists seek to join Russia.	Crimean Parliament votes to join Russia	2.8
6239	02b8256e0cb03f51c74b9bafe	Two dogs are running on the grass in front of the trees.	A brown dog is running on the grass in front of some trees.	2.8
3409	cc6478caff6e056e07a8d2243	Unit volumes also set a record, with notebooks accounting for over 40% of sales.	In May 2002, LCDs accounted for only 22 percent of monitor sales.	1.2
6946	7151409328add69604d8f631a	According to the Mohave County Sheriff's Office, the helicopter burst into flames upon impact.	According to the sheriff's office, the helicopter was owned by Las Vegas-based Sundance Helicopters Inc.	2.0
398	39d10204fa67cf3ebb9de8603	Paper is being cut with scissors.	A piece of paper is being cut.	4.0
2066	8c93143e4016c3dd2158b8a45	And yet, the Titanic story is the one that withstands scrutiny of the evidence.	In my opinion, the new study reveals that the Titanic story doesn't stand up to close scrutiny.	1.6
716	ae894ce04560e81dcdb423a5b	A man is firing a shotgun.	A man fires a shotgun.	5.0
2219	e7fe5b9e1e71651296cbfebb3	Yes, they are both distinct.	People have different opinions.	1.2
1313	c7a3bd9272ff5d1f20bf96f74	A woman wearing a navy dress is cutting a cake on a white table.	A person wearing a helmet sits on a bicycle on a sunny day.	0.4
2383	e4f9286f72faced26e2663faf	Islam itself is not political.	Islam has always been linked to politics.	1.2
